{
  "dismantlerProperties" : {
    "expiryDate" : "2024-02-22",
    "governmentAddress" : {
      "houseNumber" : "45",
      "zip" : "68161/12",
      "name" : "VLhpfQGTMDYpsBZxvfBoeygjb",
      "country" : "YE",
      "location" : "Mannheim",
      "street" : "Bernstraße"
    },
    "dismantlerAuditorContact" : {
      "fax" : "91 95155700156897981 42 0 10979592331612460542183693 999454208797240891237169867634715 90 52",
      "phone" : "09923777410560324 53301654 12640102 3548305653943262840140387631 66 1 8542 4309085095411"
    },
    "receiverAuditorAddress" : {
      "houseNumber" : "45",
      "zip" : "68161/12",
      "name" : "UMaAIKKIkknjWEXJUfPxxQHeWKEJ",
      "country" : "CR",
      "location" : "Mannheim",
      "street" : "Bernstraße"
    },
    "dismantlerContact" : {
      "fax" : "+5460 ",
      "phone" : "+2389 5079356895789371599885 58151002378035  197974 2943591530 0596175387468 737364468 82519781"
    },
    "dismantlerAuditorAddress" : {
      "houseNumber" : "45",
      "zip" : "68161/12",
      "name" : "dpHYZGhtgdntugzvvKAXLhM",
      "country" : "EX",
      "location" : "Mannheim",
      "street" : "Bernstraße"
    },
    "dismantlerAddress" : {
      "houseNumber" : "45",
      "zip" : "68161/12",
      "name" : "RYtGKbgicZaHCBRQDSx",
      "country" : "XH",
      "location" : "Mannheim",
      "street" : "Bernstraße"
    },
    "issueDate" : "2024-02-22",
    "isVehicleWithdrawnFromService" : false
  },
  "serialNumber" : "LRP1087432",
  "companyNumber" : "S30A00065",
  "vehicleProperties" : {
    "licenseAbbreviation" : "HAL",
    "isVehicleInformationComplete" : false,
    "licensePlate" : "HAL-UI123",
    "identification" : "WBAAY711X0KC28153",
    "emptyWeight" : -179769313486231570000000000000000000000000000000000000000000000000000000000000000000000000000000000000000000000000000000000000000000000000000000000000000000000000000000000000000000000000000000000000000000000000000000000000000000000000000000000000000000000000000000000000000000000000000000000000000000000000000,
    "model" : "318 I",
    "brand" : "BMW",
    "class" : "01",
    "firstRegistration" : "19.12.2014"
  },
  "returnPointProperties" : {
    "expiryDate" : "2024-02-22",
    "receiverAddress" : {
      "houseNumber" : "45",
      "zip" : "68161/12",
      "name" : "JxkyvRnL",
      "country" : "RA",
      "location" : "Mannheim",
      "street" : "Bernstraße"
    },
    "receiverAuditorAddress" : {
      "houseNumber" : "45",
      "zip" : "68161/12",
      "name" : "yedUsFwdkelQbxeTeQOvaScfqIOOmaa",
      "country" : "LL",
      "location" : "Mannheim",
      "street" : "Bernstraße"
    },
    "receiverAuditorContact" : {
      "fax" : "60 22 68357853896957221214509768170726527 5 564 4795482 121 8651803  5141979757207 ",
      "phone" : "370329411454184039192 57761654086576602580642"
    },
    "receiverContact" : {
      "fax" : "+5203 93085700742985616638 70867292 6621825477425 0873130503598064 501594906973465",
      "phone" : "618863037097697552108 461034417022"
    },
    "issueDate" : "2024-02-22",
    "isVehicleWithdrawnFromService" : true
  },
  "vehicleOwnerProperties" : {
    "isVehicleOwnerInformationComplete" : true,
    "vehicleOwnerAddress" : {
      "houseNumber" : "45",
      "zip" : "68161/12",
      "name" : "eOMtThyhVNLWUZNRcBaQKxI",
      "country" : "YG",
      "location" : "Mannheim",
      "street" : "Bernstraße"
    },
    "citizenship" : "DE"
  },
  "dismantlingDate" : "2024-02-22"
}