{
  "dismantlerProperties" : {
    "expiryDate" : "2023-03-06T14:40:35.051+01:00",
    "governmentAddress" : {
      "houseNumber" : "45",
      "zip" : "68161/12",
      "name" : "VLhpfQGTMDYpsBZxvfBoeygjb",
      "country" : "MY",
      "location" : "Mannheim",
      "street" : "Bernstraße"
    },
    "dismantlerAuditorContact" : {
      "fax" : "742828 574  3109987083399058 858950463193976874 472 8339 5754400267250 7652183007014516",
      "phone" : "48 2  42765498699 54  "
    },
    "receiverAuditorAddress" : {
      "houseNumber" : "45",
      "zip" : "68161/12",
      "name" : "UMaAIKKIkknjWEXJUfPxxQHeWKEJ",
      "country" : "YD",
      "location" : "Mannheim",
      "street" : "Bernstraße"
    },
    "dismantlerContact" : {
      "fax" : "227702 9654380042594402050740 325016050828818508043715 0245 ",
      "phone" : "+9316890473  2297422354374 0055725 5524866863  8688602 38"
    },
    "dismantlerAuditorAddress" : {
      "houseNumber" : "45",
      "zip" : "68161/12",
      "name" : "dpHYZGhtgdntugzvvKAXLhM",
      "country" : "QS",
      "location" : "Mannheim",
      "street" : "Bernstraße"
    },
    "dismantlerAddress" : {
      "houseNumber" : "45",
      "zip" : "68161/12",
      "name" : "RYtGKbgicZaHCBRQDSx",
      "country" : "RE",
      "location" : "Mannheim",
      "street" : "Bernstraße"
    },
    "issueDate" : "2023-03-06T14:40:35.051+01:00",
    "isVehicleWithdrawnFromService" : false
  },
  "serialNumber" : "LRP1087432",
  "companyNumber" : "S30A00065",
  "vehicleProperties" : {
    "licenseAbbreviation" : "HAL",
    "isVehicleInformationComplete" : false,
    "licensePlate" : "HAL-UI123",
    "identification" : "WBAAY711X0KC28153",
    "emptyWeight" : -179769313486231570000000000000000000000000000000000000000000000000000000000000000000000000000000000000000000000000000000000000000000000000000000000000000000000000000000000000000000000000000000000000000000000000000000000000000000000000000000000000000000000000000000000000000000000000000000000000000000000000000,
    "model" : "318 I",
    "brand" : "BMW",
    "class" : "01",
    "firstRegistration" : "19.12.2014"
  },
  "returnPointProperties" : {
    "expiryDate" : "2023-03-06T14:40:35.039+01:00",
    "receiverAddress" : {
      "houseNumber" : "45",
      "zip" : "68161/12",
      "name" : "JxkyvRnL",
      "country" : "WU",
      "location" : "Mannheim",
      "street" : "Bernstraße"
    },
    "receiverAuditorAddress" : {
      "houseNumber" : "45",
      "zip" : "68161/12",
      "name" : "yedUsFwdkelQbxeTeQOvaScfqIOOmaa",
      "country" : "RD",
      "location" : "Mannheim",
      "street" : "Bernstraße"
    },
    "receiverAuditorContact" : {
      "fax" : "+880984 168536540440 8698 2570696750738008922 4560064245609150028 4 475  636736414 3737",
      "phone" : "67603494  6189959509413703643997470203"
    },
    "receiverContact" : {
      "fax" : "056242466601160 1014 3648626394 86 68 5 0601 190805 6567338",
      "phone" : "23 1356019115334786 1518191099961560949819797277582367803935755404193478 8  333 6 622819"
    },
    "issueDate" : "2023-03-06T14:40:35.039+01:00",
    "isVehicleWithdrawnFromService" : true
  },
  "vehicleOwnerProperties" : {
    "isVehicleOwnerInformationComplete" : true,
    "vehicleOwnerAddress" : {
      "houseNumber" : "45",
      "zip" : "68161/12",
      "name" : "eOMtThyhVNLWUZNRcBaQKxI",
      "country" : "VG",
      "location" : "Mannheim",
      "street" : "Bernstraße"
    },
    "citizenship" : "DE"
  },
  "dismantlingDate" : "2023-03-06T14:40:34.997+01:00"
}